City,Image,CoordsLat,CoordsLong,Description
Madrid,https://imgur.com/M3gBzb9.jpeg,40.416775,-3.703790,"The vibrant capital of Spain, enchants visitors with its rich history and lively atmosphere. From the grandeur of the Royal Palace to the bustling streets of Puerta del Sol, every corner tells a story of its past. The city's cultural scene is unparalleled, with world-class museums like the Prado and Reina Sofía showcasing masterpieces by Goya, Velázquez, and Picasso. Explore the charming neighborhoods of Malasaña and La Latina, where tapas bars and flamenco clubs invite you to immerse yourself in Spanish culture. Madrid truly captures the essence of Spain's passion and charm."
Barcelona,https://imgur.com/NGyboaC.jpeg,41.385064,2.173404,"The artistic heart of Catalonia, beckons travelers with its breathtaking architecture and vibrant energy. From the whimsical designs of Antoni Gaudí to the Gothic splendor of the old town, the city is a feast for the eyes at every turn. Stroll along the iconic Ramblas, where street performers entertain crowds amidst bustling cafes and markets. Discover the surreal beauty of Park Güell or marvel at the intricate details of the Sagrada Familia. With its Mediterranean charm and avant-garde spirit, Barcelona inspires creativity and captivates the soul."
Prague,https://imgur.com/FAy7N9W.jpeg,50.075538,14.437800,"The Bohemian jewel of Central Europe, is a tapestry of medieval marvels and romantic vistas. Wander through the cobblestone streets of the Old Town Square, where Gothic spires and Baroque facades transport you back in time. Admire the majestic beauty of Prague Castle, perched atop the hill overlooking the city, or cruise along the Vltava River as the sun sets behind the iconic Charles Bridge. With its rich history, lively beer gardens, and timeless charm, Prague casts a spell on all who visit, leaving them enchanted by its beauty."
Rome,https://imgur.com/ELv3r8h.jpeg,41.902783,12.496366,"The Eternal City, is a living testament to the grandeur of the ancient world. From the awe-inspiring ruins of the Colosseum to the majestic domes of St. Peter's Basilica, every corner exudes history and magnificence. Lose yourself in the labyrinthine streets of the historic center, where hidden piazzas and ancient monuments await discovery. Indulge in the city's culinary delights, from mouthwatering pasta dishes to creamy gelato enjoyed al fresco. With its timeless beauty and vibrant street life, Rome captivates the imagination and leaves an indelible mark on all who wander its streets."
Berlin,https://imgur.com/xvItFL3.jpeg,52.520007,13.404954,"The cosmopolitan capital of Germany, is a melting pot of culture, history, and innovation. From the iconic Brandenburg Gate to the vibrant street art of the East Side Gallery, the city is a canvas where the past and present collide. Explore the trendy neighborhoods of Kreuzberg and Friedrichshain, where hip cafes and galleries thrive amidst remnants of the city's tumultuous past. Immerse yourself in Berlin's legendary nightlife, from underground clubs to rooftop bars with panoramic views. With its creative energy and unbridled spirit, Berlin invites you to embrace diversity and celebrate freedom."
Zurich,https://imgur.com/OD7GNlR.jpeg,47.376887,8.541694,"The financial hub of Switzerland, is a city of contrasts where ancient tradition meets modern innovation. From the historic charm of the Old Town to the sleek skyscrapers of the financial district, the city offers a blend of old-world elegance and contemporary flair. Explore the shores of Lake Zurich, where scenic promenades and pristine parks provide a tranquil escape from the urban hustle. Indulge in the city's culinary scene, from gourmet restaurants to cozy cafes serving Swiss delicacies. With its impeccable quality of life and breathtaking natural beauty, Zurich captivates visitors with its timeless charm."
Lisbon,https://imgur.com/gU7adzG.jpeg,38.722252,-9.139337,"The coastal capital of Portugal, bewitches travelers with its golden beaches, historic charm, and vibrant culture. From the winding streets of Alfama to the panoramic views from São Jorge Castle, the city offers a tapestry of experiences waiting to be explored. Discover the rich maritime heritage at the Belém Tower and the Monument to the Discoveries, or indulge in the flavors of Portuguese cuisine at local markets and tavernas. With its warm climate, laid-back atmosphere, and picturesque setting along the Tagus River, Lisbon exudes an irresistible allure that captures the heart of all who visit."
Amsterdam,https://imgur.com/tcUKAUa.jpeg,52.367573,4.904138,"The picturesque capital of the Netherlands, is a city of canals, culture, and creativity. From the iconic narrow houses lining the waterways to world-class museums like the Rijksmuseum and Van Gogh Museum, the city offers a wealth of artistic treasures waiting to be discovered. Explore the vibrant neighborhoods of Jordaan and De Pijp, where trendy boutiques and cozy cafes abound. Cruise along the historic canals, passing under charming bridges and past picturesque houseboats. With its relaxed vibe and progressive spirit, Amsterdam invites you to embrace its unique blend of history and modernity."
Paris,https://imgur.com/cL1s2Iv.jpeg,48.856614,2.352222,"The romantic capital of France, enchants visitors with its timeless beauty, iconic landmarks, and unparalleled charm. From the majestic Eiffel Tower to the historic streets of Montmartre, every corner of the city exudes elegance and sophistication. Immerse yourself in the world-class art collections of the Louvre and Musée d'Orsay, or savor the culinary delights of Parisian bistros and patisseries. Stroll along the Seine River at sunset, where the city's lights illuminate the skyline in a breathtaking display of romance. With its poetic ambiance and irresistible allure, Paris captures the hearts of lovers and dreamers alike."
London,https://imgur.com/Dl7FXeX.jpeg,51.507351,-0.127758,"The dynamic capital of England, is a city of contrasts where tradition meets innovation. From the historic landmarks of Buckingham Palace and the Tower of London to the cutting-edge architecture of the Shard and the Gherkin, the city offers a blend of old-world charm and modern sophistication. Explore the vibrant neighborhoods of Soho and Camden, where street markets and hip boutiques thrive amidst a backdrop of cultural diversity. Indulge in the city's culinary scene, from traditional pub fare to Michelin-starred dining experiences. With its rich history, diverse culture, and endless opportunities for adventure, London captivates visitors with its timeless allure."
Florence,https://imgur.com/SZVdWmA.jpeg,43.769560,11.255814,"The artistic capital of Tuscany, is a treasure trove of Renaissance splendor and architectural marvels. From the iconic dome of the Florence Cathedral to the masterpieces of the Uffizi Gallery, the city is a living museum where every street corner tells a story of its illustrious past. Wander through the charming piazzas of the historic center, where bustling markets and sidewalk cafes invite you to savor the flavors of Italian cuisine. Discover the beauty of the Ponte Vecchio at sunset or take in panoramic views from the Boboli Gardens. With its timeless beauty and cultural significance, Florence captivates the hearts of art lovers and history buffs alike."
Milan,https://imgur.com/4fScA3B.jpeg,45.465422,9.185924,"The fashion capital of Italy, is a city of style, sophistication, and innovation. From the iconic fashion houses of Via Montenapoleone to the historic landmarks of the Duomo and La Scala, the city exudes elegance and glamour at every turn. Explore the trendy neighborhoods of Brera and Navigli, where chic boutiques and art galleries abound. Indulge in the city's culinary delights, from gourmet restaurants to bustling street markets serving authentic Milanese cuisine. With its cosmopolitan vibe and avant-garde spirit, Milan inspires creativity and sets the trends for fashionistas around the world."
Vienna,https://imgur.com/pPFfbSN.jpeg,48.208174,16.373819,"The imperial capital of Austria, is a city of classical beauty, cultural richness, and musical heritage. From the grandeur of Schönbrunn Palace to the elegant streets of the Ringstrasse, the city offers a glimpse into its glorious past as the former seat of the Habsburg Empire. Immerse yourself in the world-class music scene, from the Vienna Philharmonic Orchestra to the legendary Vienna State Opera. Explore the charming cafes and wine taverns of the old town, where locals gather to enjoy traditional Viennese cuisine and fine wines. With its timeless elegance and artistic legacy, Vienna captivates visitors with its old-world charm and sophisticated ambiance."
Brussels,https://imgur.com/0zHYkU9.jpeg,50.850346,4.351721,"The political capital of Belgium, is a city of cultural diversity, architectural splendor, and culinary delights. From the iconic Atomium to the medieval charm of the Grand Place, the city offers a blend of historic landmarks and modern attractions waiting to be explored. Discover the vibrant street art scene of the Marolles district or indulge in the flavors of Belgian cuisine at local brasseries and chocolatiers. With its lively markets, bustling squares, and rich cultural heritage, Brussels invites visitors to experience the best of Belgian hospitality and charm."
Budapest,https://imgur.com/DdeXwsN.jpeg,47.497912,19.040235,"The bohemian capital of Hungary, is a city of thermal baths, historic grandeur, and artistic flair. From the majestic beauty of Buda Castle to the bustling streets of Pest, the city offers a wealth of experiences waiting to be discovered. Relax in the healing waters of the Széchenyi Thermal Bath or take in panoramic views from the Fisherman's Bastion. Explore the vibrant Jewish Quarter, where trendy ruin bars and eclectic boutiques thrive amidst historic synagogues and monuments. With its rich history, vibrant culture, and stunning architecture, Budapest captivates visitors with its unique blend of old-world charm and modern energy."
Munich,https://i.imgur.com/GPBzHwz.jpeg,48.135125,11.581981,"The beer capital of Germany, is a city of tradition, culture, and Bavarian hospitality. From the festive atmosphere of the Oktoberfest to the historic landmarks of Marienplatz and Nymphenburg Palace, the city offers a blend of old-world charm and modern amenities. Explore the lush gardens of the Englischer Garten or savor the flavors of traditional Bavarian cuisine at local beer gardens and taverns. With its vibrant cultural scene, world-class museums, and lively beer halls, Munich invites visitors to experience the best of Bavarian culture and hospitality."
Dublin,https://imgur.com/7pYcq7D.jpeg,53.349805,-6.260310,"The whiskey capital of Ireland, is a city of literary legends, historic landmarks, and friendly locals. From the cobblestone streets of Temple Bar to the elegant Georgian squares of Merrion Square, the city offers a blend of old-world charm and modern excitement. Explore the vibrant pub scene, where traditional Irish music and hearty fare await at every turn. Discover the rich literary heritage at the Dublin Writers Museum or stroll along the scenic banks of the River Liffey. With its warm hospitality, lively atmosphere, and rich cultural heritage, Dublin captivates visitors with its timeless charm and Irish spirit."
